I'm looking for a job,seeker
I need a gig,seeker
I need a job,seeker
Looking for a php position,seeker
Any Unity3D position?,seeker
Any nodejs position?,seeker
I need a Unreal job,seeker
I want a job with huge salary,seeker
Need to work,seeker
I need an employer,seeker
Looking for a programming role,seeker
Looking for a sale role,seeker
Looking for a management role,seeker
I want an engineer role,seeker
I am looking for a design role,seeker
Any graphic design job?,seeker
I am looking for a job,seeker
To work,seeker
I'm looking for a nodejs developer,poster
I am looking for a php developer,poster
I need a programmer,poster
I need someone to work on my project,poster
I need to hire someone,poster
Looking for someone available,poster
Looking for talent,poster
I'm seeking some talent,poster
I need some people,poster
Need to hire someone,poster
I want to employ someone,poster
I need a good sale person,poster
I need a laser cutter engineer,poster
Looking for an engineer,poster
Anyone looking for a graphic design job?,poster
I'm looking to hire,poster
To hire,poster
